{
 "school": "epfl",
 "generated_at": "2026-11-01T04:06:19+00:00",
 "tool": "tools/labpage_audit.py",
 "standard": "docs/LAB-PAGES.md",
 "status": "proposed, unreviewed: not read by tools/pi_hierarchy.py until wired (docs/LAB-PAGES.md, integration)",
 "rules": {
  "LP-STU-01": "A person listed on the PI's own lab page (people, members, alumni section; live page or a Wayback id_ capture), under a people heading, not the PI, not in a faculty/collaborator/staff section, not another PI of the school, whose stated years do not end before 2016 or before the PI's appointment at the school, and who is dated or listed as current on a 2016+ capture (undated alumni only when the lab has only ever been at this school) is a lab member: the same admission the 2026-10-22 lab-page rows had (labpage-evidence.json, R-STU-01 'researched advisees'), with url, sha256 and a verbatim quote naming the person.",
  "LP-PAP-01": "A paper listed on the PI's own lab publications page whose resolved work carries the PI on the byline, falls in the PI's appointment (R-PAP-01) and whose PI authorship lists the school (or page 1 ties the school to the PI) is a lab paper with identity 'labpage_listing' (R-PAP-04: the lab's own publications page), exactly the rows tools/labpage_recover.py accepts into labpage-recovered.jsonl.gz."
 },
 "students": [
  {
   "name": "Darius Sidlauskas",
   "role": "postdoc",
   "years": [
    2018,
    2018
   ],
   "url": "https://www.epfl.ch/labs/dias/people/",
   "capture_url": "https://web.archive.org/web/20230922125657id_/https://www.epfl.ch/labs/dias/people/",
   "sha256": "9fbc7c192a55c547c41234bac1072be60cb77e6584cd7a631e866577a13faa79",
   "quote": "Post-docs Haoqiong Bian, 2023, Remin University, China Ioannis Mytilinis, 2021, Oracle, CH Srinivas Karthik, 2021, Huawei, India Bikash Chandra, 2021, Meta, USA Angelos-Christos Anadiotis, 2019, Ecole Polytechnique de Paris, FR Odysseas Papapetrou , 2018, Eindhoven University of Technology, NL Foteini Alvanaki , 2018, Amazon, UK Tahir Azim , 2018, Amazon, Australia Darius Sidlauskas",
   "note": "lab-page audit 2026-10-31; section: Post-docs",
   "pi": "Anastasia Ailamaki",
   "alumni": true,
   "rule": "LP-STU-01",
   "auto": true,
   "pi_first_year": 2008,
   "role_basis": "section_heading",
   "years_basis": "stated_in_entry"
  },
  {
   "name": "Othmane Safsafi",
   "role": "postdoc",
   "years": [
    2021,
    2022
   ],
   "url": "https://www.epfl.ch/labs/sacs/alumni/",
   "sha256": "7b22ae8a6c38da0d2b29d5422297bd366b1ec0f289aee704a320954716b5f202",
   "quote": "Post-docs Erick Lavoie (2020 – 2022) Othmane Safsafi",
   "note": "lab-page audit 2026-10-31; section: Post-docs",
   "pi": "Anne-Marie Kermarrec",
   "alumni": true,
   "rule": "LP-STU-01",
   "auto": true,
   "pi_first_year": 2020,
   "role_basis": "section_heading",
   "years_basis": "stated_in_entry"
  },
  {
   "name": "Elia Guerra",
   "role": "phd",
   "years": [
    2023,
    null
   ],
   "url": "https://www.epfl.ch/labs/sacs/alumni/",
   "sha256": "7b22ae8a6c38da0d2b29d5422297bd366b1ec0f289aee704a320954716b5f202",
   "quote": "Visiting PhD Students Elia Guerra",
   "note": "lab-page audit 2026-10-31; section: Visiting PhD Students",
   "pi": "Anne-Marie Kermarrec",
   "alumni": true,
   "rule": "LP-STU-01",
   "auto": true,
   "pi_first_year": 2020,
   "role_basis": "section_heading",
   "years_basis": "stated_in_entry"
  },
  {
   "name": "Tuan Anh Nguyen Huu",
   "role": "phd",
   "years": [
    2023,
    null
   ],
   "url": "https://www.epfl.ch/labs/sacs/alumni/",
   "sha256": "7b22ae8a6c38da0d2b29d5422297bd366b1ec0f289aee704a320954716b5f202",
   "quote": "Visiting PhD Students Elia Guerra (2023 – Centre Tecnològic de Telecomunicatcions de Catalunya) Tuan Anh Nguyen Huu",
   "note": "lab-page audit 2026-10-31; section: Visiting PhD Students",
   "pi": "Anne-Marie Kermarrec",
   "alumni": true,
   "rule": "LP-STU-01",
   "auto": true,
   "pi_first_year": 2020,
   "role_basis": "section_heading",
   "years_basis": "stated_in_entry"
  },
  {
   "name": "Leijie Wu",
   "role": "phd",
   "years": [
    2023,
    null
   ],
   "url": "https://www.epfl.ch/labs/sacs/alumni/",
   "sha256": "7b22ae8a6c38da0d2b29d5422297bd366b1ec0f289aee704a320954716b5f202",
   "quote": "Visiting PhD Students Elia Guerra (2023 – Centre Tecnològic de Telecomunicatcions de Catalunya) Tuan Anh Nguyen Huu (2023 – Université Grenoble Alpes) Marie Reinbigler (2023 – Telecom SudParis) Leijie Wu",
   "note": "lab-page audit 2026-10-31; section: Visiting PhD Students",
   "pi": "Anne-Marie Kermarrec",
   "alumni": true,
   "rule": "LP-STU-01",
   "auto": true,
   "pi_first_year": 2020,
   "role_basis": "section_heading",
   "years_basis": "stated_in_entry"
  },
  {
   "name": "Guilhem Niot",
   "role": null,
   "years": [
    2021,
    2021
   ],
   "url": "https://www.epfl.ch/labs/sacs/alumni/",
   "capture_url": "https://web.archive.org/web/20220702021744id_/https://www.epfl.ch/labs/sacs/alumni/",
   "sha256": "9d6f0336be2b7982e05b2aed48e9e0995aa3b383c7574a73a6aab489005d7de4",
   "quote": "Interns Spring/Summer 2021 Guilhem Niot",
   "note": "lab-page audit 2026-10-31; section: Interns",
   "pi": "Anne-Marie Kermarrec",
   "alumni": true,
   "rule": "LP-STU-01",
   "auto": true,
   "pi_first_year": 2020,
   "role_basis": "none",
   "years_basis": "stated_in_entry"
  },
  {
   "name": "Nevena Drešević",
   "role": null,
   "years": [
    2021,
    2021
   ],
   "url": "https://www.epfl.ch/labs/sacs/alumni/",
   "capture_url": "https://web.archive.org/web/20220702021744id_/https://www.epfl.ch/labs/sacs/alumni/",
   "sha256": "9d6f0336be2b7982e05b2aed48e9e0995aa3b383c7574a73a6aab489005d7de4",
   "quote": "Master Semester Projects Spring 2022 Nevena Drešević",
   "note": "lab-page audit 2026-10-31; section: Master Semester Projects",
   "pi": "Anne-Marie Kermarrec",
   "alumni": true,
   "rule": "LP-STU-01",
   "auto": true,
   "pi_first_year": 2020,
   "role_basis": "none",
   "years_basis": "stated_in_entry"
  },
  {
   "name": "Samuel Thirion",
   "role": null,
   "years": [
    2021,
    2021
   ],
   "url": "https://www.epfl.ch/labs/sacs/alumni/",
   "capture_url": "https://web.archive.org/web/20220702021744id_/https://www.epfl.ch/labs/sacs/alumni/",
   "sha256": "9d6f0336be2b7982e05b2aed48e9e0995aa3b383c7574a73a6aab489005d7de4",
   "quote": "Master Semester Projects Spring 2022 Nevena Drešević Fall 2021 Raphaël Dung Attias Pauline Conti Kang Fu Alexander Glavackij Karim Hadidane Maina Orchampt-Mareschal Peng Ren Samuel Thirion",
   "note": "lab-page audit 2026-10-31; section: Master Semester Projects",
   "pi": "Anne-Marie Kermarrec",
   "alumni": true,
   "rule": "LP-STU-01",
   "auto": true,
   "pi_first_year": 2020,
   "role_basis": "none",
   "years_basis": "stated_in_entry"
  },
  {
   "name": "St Julian’s",
   "role": null,
   "years": [
    2024,
    2024
   ],
   "url": "https://www.epfl.ch/labs/dhlab/index-html/page-88053-en-html/",
   "sha256": "d90bd597fbf794fdafbeec5a29abca25171b87079f9f3c38fa3aa2d5a570af72",
   "quote": "2024) 2024 The 8th Joint SIGHUM Workshop on Computational Linguistics for Cultural Heritage, Social Sciences, Humanities and Literature, St Julian’s",
   "note": "lab-page audit 2026-10-31; section: Student Projects > 2024",
   "pi": "Frédéric Kaplan",
   "alumni": false,
   "rule": "LP-STU-01",
   "auto": true,
   "pi_first_year": null,
   "role_basis": "none",
   "years_basis": "stated_in_entry"
  },
  {
   "name": "Alexandru Constantin",
   "role": "postdoc",
   "years": [
    2018,
    2018
   ],
   "url": "https://www.epfl.ch/labs/lsir/members/members-former-group-members/",
   "sha256": "c066f228bbc43442e389ef10f04919cb976aa02541edd15cfe4881b3f51e56e8",
   "quote": "2018 Alexandru Constantin",
   "note": "lab-page audit 2026-10-31; section: Postdocs : > 2018",
   "pi": "Karl Aberer",
   "alumni": true,
   "rule": "LP-STU-01",
   "auto": true,
   "pi_first_year": null,
   "role_basis": "section_heading",
   "years_basis": "section_year_heading"
  },
  {
   "name": "Natalia Boyarskaya",
   "role": "postdoc",
   "years": [
    2017,
    2017
   ],
   "url": "https://www.epfl.ch/labs/lsir/members/members-former-group-members/",
   "sha256": "c066f228bbc43442e389ef10f04919cb976aa02541edd15cfe4881b3f51e56e8",
   "quote": "2017 Natalia Boyarskaya",
   "note": "lab-page audit 2026-10-31; section: Postdocs : > 2017",
   "pi": "Karl Aberer",
   "alumni": true,
   "rule": "LP-STU-01",
   "auto": true,
   "pi_first_year": null,
   "role_basis": "section_heading",
   "years_basis": "section_year_heading"
  },
  {
   "name": "Michele Catasta",
   "role": "postdoc",
   "years": [
    2017,
    2017
   ],
   "url": "https://www.epfl.ch/labs/lsir/members/members-former-group-members/",
   "sha256": "c066f228bbc43442e389ef10f04919cb976aa02541edd15cfe4881b3f51e56e8",
   "quote": "Michele Catasta Postdoctoral",
   "note": "lab-page audit 2026-10-31; section: Postdocs : > 2017",
   "pi": "Karl Aberer",
   "alumni": true,
   "rule": "LP-STU-01",
   "auto": true,
   "pi_first_year": null,
   "role_basis": "entry",
   "years_basis": "stated_in_entry"
  },
  {
   "name": "Julien Eberle",
   "role": "other",
   "years": [
    2016,
    2016
   ],
   "url": "https://www.epfl.ch/labs/lsir/members/members-former-group-members/",
   "sha256": "c066f228bbc43442e389ef10f04919cb976aa02541edd15cfe4881b3f51e56e8",
   "quote": "2017 Dr Michele Catasta Postdoctoral Research Fellow at Stanford University 2017, MEM0R1ES: Memory-based Information Systems Dr Julien Eberle",
   "note": "lab-page audit 2026-10-31; section: Postdocs : > 2017",
   "pi": "Karl Aberer",
   "alumni": true,
   "rule": "LP-STU-01",
   "auto": true,
   "pi_first_year": null,
   "role_basis": "entry",
   "years_basis": "stated_in_entry"
  },
  {
   "name": "Vsevolod Soloviov",
   "role": "postdoc",
   "years": [
    2017,
    2017
   ],
   "url": "https://www.epfl.ch/labs/lsir/members/members-former-group-members/",